student_id,question,ai_likeness_score,ai_likeness_comment,answer_text
S005,Q5,0.25,構造化は比較的整っているものの、序論・本論・結論の区分は明確ではなく、自然な流れを保った長文が多い。定型表現はほとんど見られず、文体の均一性もそこまで強くない。具体例は授業計画として一般的な内容で、他の学生と中程度の類似度しか持たないため、AIが用いる典型的なテンプレートの特徴は薄い。,"Chủ đề: BỨC TRANH ĐÈN LED THÔNG TIN VỀ BÀI HỌC Lớp 5 Thời lượng: 2 tiết Thời điểm tổ chức: Khi dạy nội dung chủ đề 2: Năng lượng, bài 7: Mạch điện đơn giản. Mô tả bài học: Nội dung Mạch điện đơn giản môn Khoa học lớp 5 có yêu cầu cần đạt như sau: Mô tả được cấu tạo và hoạt động của mạch điện thắp sáng gồm: nguồn điện, công tắc và bóng đèn. Để đạt được các yêu cầu này, trong bài học STEM “Bức tranh đèn LED”, học sinh sẽ tìm hiểu và tự thiết kế mạch điện đèn sáng có kích thước phù hợp, có giá trị ứng dụng, mang tính thẩm mĩ với bức tranh của nhóm. Nội dung chủ đạo và tích hợp trong bài học Môn học Yêu cầu cần đạt Môn học chủ đạo Khoa học - Mô tả được cấu tạo và hoạt động của mạch điện thắp sáng gồm: nguồn điện, công tắc và bóng đèn. Thực hành lắp được một mạch điện thắp sáng đơn giản. Môn học tích hợp Toán - Thực hiện được các phép tính cộng, trừ, nhân, chia các số tự nhiên. Vận dụng được tính chất của phép tính với số tự nhiên để tính nhẩm và tính hợp lí. Công nghệ Vẽ phác thảo, nêu được ý tưởng thiết kế một sản phẩm công nghệ đơn giản. Thiết kế được một sản phẩm thủ công kĩ thuật đơn giản theo hướng dẫn. Mĩ thuật Nhận biết được sự đa dạng của vật liệu tự nhiên, vật liệu nhân tạo trong các sản phẩm mĩ thuật. Biết lựa chọn, phối hợp các vật liệu tự nhiên, vật liệu nhân tạo phù hợp để thực hành, sáng tạo sản phẩm mĩ thuật. I. Yêu cầu cần đạt (của bài học) Mô tả được cấu tạo và hoạt động của mạch điện thắp sáng gồm: nguồn điện, công tắc, dây dẫn và bóng đèn. Mô tả được cách nối đèn LED với pin. Làm được công tắc đơn giản. Phác thảo được ý tưởng sản phẩm; thiết kế và chế tạo được một bức tranh có gắn đèn LED ứng dụng kiến thức về mạch điện đơn giản. Cẩn thận trong việc tiến hành đo các kích thước khi gắn dây điện và tính toán lắp đặt đèn tại vị trí nổi bật một cách khoa học. Giữ gìn vệ sinh và đảm bảo an toàn trong quá trình làm sản phẩm. Tích cực, chủ động đóng góp ý kiến để hoàn thiện sản phẩm của nhóm. II. Đồ dùng dạy học 1. Chuẩn bị của giáo viên Phiếu học tập. Phiếu đánh giá. Sản phẩm mẫu GV đã làm sẵn Nguyên vật liệu giáo viên cung cấp cho các nhóm STT Thiết bị/ Học liệu Số lượng Hình ảnh minh họa 1 Pin cúc áo 3V 5 pin/nhóm 2 Bóng đèn LED 1 túi/nhóm 3 Ghim cánh phượng đồng 1 túi/nhóm 4 Băng dính đồng 1 cuộn/nhóm 5 Kẹp giấy (bằng kim loại) 1 túi/nhóm 6 Bìa cứng 1 tờ 7 Mô hình bức tranh gắn đèn LED 1 mô hình dùng chung cho cả lớp 1. Chuẩn bị của học sinh - Giao cho mỗi nhóm tự chuẩn bị một số nguyên vật liệu như sau: STT Thiết bị/ Học liệu Số lượng Hình ảnh minh họa 1 Sách giáo khoa 1 cuốn/HS 2 Kéo học sinh 1 cây/nhóm 3 Bộ lắp ráp mạch điện đơn giản lớp 5 1 bộ/ nhóm 4 Compa 1 5 Thước kẻ 1 cây 6 Bút màu 1 hộp/ nhóm III. CÁC HOẠT ĐỘNG DẠY HỌC CHỦ YẾU 1. Hoạt động 1. Mở đầu (Xác định vấn đề) a) Khởi động - HS xem video về các hình ảnh vui chơi đêm Trung thu và trả lời các câu hỏi: * Làm sao để lồng đèn có thể sáng lên? → bật công tắc đèn pin, đốt nến,... GV dẫn dắt và chuyển ý: Em làm Bức tranh đèn LED để tặng người thân. Bức tranh phải đạt những yêu cầu gì? b) Giao nhiệm vụ Học sinh ghi nhận nhiệm vụ thực hiện một bức tranh đèn LED với các yêu cầu cụ thể vào vở: + Đèn LED sáng và gắn phù hợp với bức tranh. + Công tắc đèn đóng/ mở dễ dàng. + Các bộ phận của mạch điện gắn với nhau chắc chắn, gọn gàng. + Tranh được trang trí hài hòa, đẹp, sáng tạo. Chuyển ý: Vậy muốn làm được bức tranh đèn LED thì em cần thực hiện những công việc gì? 2. Hoạt động 2: Hình thành kiến thức mới (Nghiên cứu kiến thức nền) a/ Tìm hiểu một số bộ phận trong một mạch điện thắp sáng * Mục tiêu: Học sinh kể tên và nêu được vai trò của các bộ phận của một mạch điện thắp sáng. Các nhóm quan sát bộ lắp ráp một mạch điện đơn giản và thảo luận theo yêu cầu sau: Vòng 1: Nhóm chuyên gia + Nhóm 1 và nhóm 2: tìm hiểu vai trò, cấu tạo và hoạt động của nguồn điện. + Nhóm 3 và nhóm 4: tìm hiểu vai trò, cấu tạo và hoạt động của bóng đèn. + Nhóm 5 và nhóm 6: tìm hiểu vai trò, cấu tạo và hoạt động của dây dẫn. + Nhóm 7 và nhóm 8: tìm hiểu vai trò, cấu tạo và hoạt động của công tắc. - Vòng 2: Nhóm mảnh ghép: *Nhiệm vụ: Kể tên và mô tả vai trò, cấu tạo, hoạt động của các bộ phận trong một mạch điện thắp sáng. Các nhóm trình bày và chia sẻ trước lớp. Các nhóm theo dõi và nhận xét lẫn nhau. Giáo viên nhận xét và hướng dẫn học sinh rút ra kết luận. * Mạch điện thắp sáng đơn giản gồm các bộ phận: nguồn điện, công tắc, bóng đèn và dây dẫn. ** Pin có hai cực: cực dương (+) thường lồi, cực âm (-) bằng phẳng. ** Khi có dòng điện chạy qua bóng đèn sợi đốt thì sợi đốt bên trong bóng đèn sẽ nóng đến nhiệt độ cao và phát sáng. *** Mở rộng thêm nội dung: Cực dương Cực âm Bình ắc quy Cực dương Cực âm Bình ắc quy Chân âm Chân dương Băng dính đồng Chân âm Chân dương Băng dính đồng b/ Thí nghiệm “Lắp một mạch điện thắp sáng đơn giản” * Mục tiêu: HS thực hành lắp được một mạch điện thắp sáng đơn giản. HS quan sát, thảo luận và so sánh điểm giống nhau - khác nhau giữa hình 3a và 3b trong SGK/tr30. Học sinh trả lời và nhận xét. Giáo viên nhận xét. Học sinh xem video cách lắp mạch điện đơn giản. Học sinh thực hành thí nghiệm và ghi kết quả vào phiếu học tập 1. Học sinh trình bảy sản phẩm và nói rõ theo phiếu học tập 1. Học sinh rút ra kết luận. GV nhận xét và chốt bài học. ** Trong mạch điện, dây dẫn nối các bộ phận của mạch điện với nhau và cho dòng điện đi qua, nguồn điện cung cấp điện giúp bóng đèn phát sáng, công tắc dùng để đóng, ngắt mạch điện. 3. Hoạt động 3: Luyện tập và vận dụng Chuyển tiết: HS hát và múa cùng cây đèn LED: bài hát “Quê hương tươi đẹp”. * Cây đèn này gọi là đèn gì? → Đèn LED. *Trong đời sống hằng ngày, các em thấy đèn LED được dùng để trang trí, quảng cáo. GV chuyển ý. Giáo viên yêu cầu học sinh nhắc lại các tiêu chí đánh giá sản phẩm. Học sinh nhắc lại các tiêu chí đánh giá sản phẩm. GV chuyển ý. Giáo viên cho xem mô hình tranh gắn đèn LED. Học sinh quan sát mô hình. Giáo viên cho các em xem đoạn clip hướng dẫn làm công tắc đơn giản. - Học sinh nêu các bộ phận và nhắc lại các bước thực hiện làm công tắc sáng tạo. ** Tiến hành thực hiện: a) Đề xuất và lựa chọn giải pháp * Giáo viên chia lớp thành 6 nhóm. Các nhóm thảo luận, từ đó: + Phác thảo giải pháp, các bước tiến hành chế tạo bức tranh đèn LED và hoàn thành phiếu học tập 2. + Lựa chọn nguyên vật liệu tương ứng với các bộ phận của mạch điện và hoàn thành phiếu học tập 3. + Gợi ý: Nguồn điện, công tắc và đèn LED của mạch điện được bố trí như thế nào? Sử dụng các vật liệu nào để làm mạch điện? Băng dính đồng được dán như thế nào mang tính thẩm mĩ? Giáo viên theo dõi và hỗ trợ học sinh khi cần thiết. Đại diện các nhóm trình bày ý tưởng thiết kế bức tranh. Giáo viên tổng kết ý tưởng. ** GV lưu ý: cấu trúc mạch điện; tranh được sử dụng để treo tường hay để bàn. Chế tạo mẫu, thử nghệm và đánh giá: Tiến hành thiết kế sản phẩm. Khi hết thời gian làm sản phẩm giáo viên sẽ rung chuông. Các nhóm có 2 phút để thu gọn sạch sẽ khu vực làm việc.  Các nhóm tiến hành chế tạo và thử nghiệm sản phẩm theo bản vẽ đã được góp ý. Trong quá trình làm sản phẩm, các nhóm có thể điều chỉnh phương án (nếu cần). Ghi chú lại điều chỉnh này. Giáo viên quan sát và hỗ trợ các nhóm trong quá trình chế tạo và thử nghiệm sản phẩm. Các nhóm tự đánh giá sản phẩm của nhóm mình đã đạt các yêu cầu giáo viên đề ra ban đầu chưa. Chia sẻ, thảo luận và điều chỉnh: GV tổ chức triển lãm tranh. Đại diện các nhóm chia sẻ, giới thiệu về nội dung bức tranh và cách lắp mạch điện thắp sáng đèn LED. Các nhóm khác lắng nghe và nhận xét. Bình chọn nhóm có sản phẩm đáp ứng tốt các tiêu chí đề ra và có phần chia sẻ hay nhất. (cắm cây đèn LED trái tim vào hộp nhóm muốn bình chọn) Giáo viên khen ngợi nhóm học sinh tích cực tham gia hoạt động, nhận được nhiều cây đèn trái tim và động viên các nhóm học sinh làm chưa tốt để lần sau cố gắng hơn. Giáo viên nhận xét và tổng kết. Cải tiến, sáng tạo: Hãy sáng tạo thêm để bức tranh thú vị hơn với gợi ý: kéo một chi tiết trên bức tranh để đèn sáng. Giáo viên cho học sinh chia sẻ cảm nghĩ khi tham gia tiết học. * Từ sản phẩm trên có thể thiết kế thêm các Bài học STEM như: chủ đề nhà máy điện phát sáng, chủ đề máy quạt điện, đèn pin bỏ túi, đèn bàn học,.....










Sản phẩm cây đa quê hương, Học sinh chọn vị trí đèn led trên tán cây Sản phẩm của nhóm cầu vòng, Học sinh chọn vị trí đèn led trên cối xay gió Sản phẩm của nhóm Rực rỡ, Học sinh chọn vị trí đèn led trên đèn xe"
S006,Q1,0.35,回答は序論・本論・結論の構成が明確で、定型表現や語彙の均一性がある程度保たれていますが、AIのテンプレート的な表現（例えば「これにより」「その結果」などの過度な繰り返し）は少なく、具体例も一般的な学習活動に沿っているため、完全にAI生成と断定できません。AIとの類似度が0.00である点と、他者との類似度が0.41程度である点を考慮すると、AIで書かれたテンプレート的解答の可能性は中程度と評価しました。,"- 'Học tập qua trải nghiệm' có nghĩa là Học qua trải nghiệm thực tế và tự mình thực hiện. Học sinh là người khám phá, giải quyết vấn đề và sáng tạo. Thay vì chỉ nghe giảng, các em trực tiếp làm – trực tiếp thử – trực tiếp rút ra bài học từ hành động của chính mình.- Giải thích:Học tập trải nghiệm là phương pháp trong đó học sinh chủ động tham gia và học thông qua các hành động và trải nghiệm thực tế, và là phương pháp cốt lõi của giáo dục STEAM.Tác động: Học tập qua trải nghiệm mang lại nhiều lợi ích và tác động tích cực đáng kể đến sự phát triển toàn diện của học sinh như: Tăng tính chủ động và hứng thú học tập, Phát triển tư duy phản biện và giải quyết vấn đề, Gắn kết lý thuyết với thực hành, Nâng cao kỹ năng làm việc nhóm và giao tiếp- Ví dụ:Học sinh tìm hiểu về Tính chất của nước, học sinh sẽ được tham gia hoạt động thực tế:+ Học sinh được phát các vật liệu đơn giản như cốc nước, thìa, muối, đường, cát, đá viên, và một số vật nổi/chìm (ví dụ: ghim giấy, nút chai). Các em sẽ tự tay thực hiện các thí nghiệm nhỏ: - Thí nghiệm hòa tan: Thử hòa tan muối, đường, cát vào nước và quan sát điều gì xảy ra, từ đó khám phá tính chất ""nước là có thể hòa tan một số chất"".- Thí nghiệm nổi/chìm: Thả các vật khác nhau vào nước để xem vật nào nổi, vật nào chìm, và thảo luận về nguyên nhân.- Thí nghiệm trạng thái: Quan sát đá viên tan chảy và nước đóng băng, nước đun sôi.. hiểu về ba thể của nước.Tác động: Qua các hoạt động này, học sinh không chỉ ghi nhớ các tính chất của nước một cách thụ động mà còn tự mình khám phá, quan sát, suy luận, và rút ra kết luận. Các em sẽ trực tiếp nhìn thấy muối biến mất trong nước, cảm nhận sự thay đổi trạng thái của đá, và tự tin giải thích tại sao ghim giấy lại chìm. Điều này giúp kiến thức trở nên sống động, dễ hiểu và khó quên hơn nhiều so với việc chỉ đọc từ sách giáo khoa."
S006,Q2,0.35,"The answer is moderately structured with clear headings and bullet points, resembling a common template. However, the AI similarity score of 0.00 suggests it does not match the AI model’s typical output, and the peer similarity of 0.35 indicates only moderate overlap with other students. The language is fairly uniform but not overly formal or laden with positive bias, and the example of a recyclable 3‑D ecological corner is not an overused generic case. Overall, it shows some template‑like features but lacks the strong AI‑hallmarks that would push the score higher.","Tên hoạt động: “Góc sinh thái vui nhộn – Chuỗi thức ăn quanh ta”- Mục tiêu:Giúp học sinh tìm hiểu chuỗi thức ăn trong tự nhiên thông qua việc sáng tạo mô hình trang trí lớp học, đồng thời tạo không gian học tập gần gũi với thiên nhiên và thoải mái hơn.- Mô tả hoạt động:Học sinh sẽ được chia nhóm để thiết kế một “Góc sinh thái chuỗi thức ăn” trong lớp học bằng vật liệu tái chế.Các bước thực hiện:Lên ý tưởng: Mỗi nhóm chọn một hệ sinh thái (rừng, ao hồ, đồng cỏ...) và xác định chuỗi thức ăn điển hình: sinh vật sản xuất → tiêu thụ → phân hủy.Thực hiện ý tưởng: Học sinh sử dụng chai nhựa, hộp giấy, bìa cứng, ống hút... để tạo mô hình 3D các sinh vật (cây, động vật, nấm...). Thực hiện trang trí sơn màu, vẽ mắt, tạo hình dễ thương để mô hình sinh động và thân thiện.- Thuyết trình - Trưng bày sản phẩm: Các mô hình được sắp xếp thành một góc sinh thái cố định trong lớp, giúp lớp học thêm sinh động và học sinh thấy gần gũi với thiên nhiên.- Đánh giá – cải tiến: Mỗi nhóm trình bày về chuỗi thức ăn mình tạo ra và trả lời các câu hỏi về vai trò của từng sinh vật và Điều chỉnh cải tiến lại sản phẩm của nhóm.- Kỹ năng và năng lực phát triển:+ Tư duy hệ thống, hiểu biết khoa học+ Kỹ năng làm việc nhóm và thuyết trình+ Khả năng sáng tạo và sử dụng vật liệu tái chế+ Hình thành ý thức bảo vệ môi trường và yêu thiên nhiênHoạt động không chỉ giúp các em thõa sức sáng tạo mà làm không khí lớp học vui hơn, giúp học sinh yêu thiên nhiên."
S006,Q3,0.32,構造化はしっかりとした序論・本論・結論の区分が見られますが、語彙の選び方や文の長さに大きなばらつきはなく、いわゆるAIのテンプレート的なパターンには当てはまりにくいです。定型表現はほぼなく、具体例は一般的な授業計画であるため他学生とも重複しやすいものの、AI特有のポジティブバイアスや機械的な言い回しは見受けられません。symbolic_score が 1 なのは、箇条書きや章立てといった「シンボリックな構造」を多用していることを示していますが、これは教育資料の一般的なスタイルであり、必ずしもAI生成を示唆するものではありません。総合すると、AIによるテンプレート的解答の可能性は低いと評価でき、0.32 という低めのスコアを付けました。,"Kế hoạch dạy học: Bảo vệ viên phấn khi rơiMục tiêu bài học:Học sinh sử dụng kiến thức về vật lý và kỹ thuật để thiết kế một thiết bị bảo vệ viên phấn không bị vỡ khi rơi từ độ cao 3 mét, qua đó học sinh tự mình tư duy, thử nghiệm và cải tiến để tìm ra giải pháp tối ưu, từ đó rèn luyện tư duy logic và năng lực sáng tạo.1. Khởi động (10 phút)Giáo viên đặt câu hỏi khơi gợi:- “Điều gì xảy ra khi viên phấn rơi xuống đất?”- “Làm thế nào để bảo vệ một vật dễ vỡ?”Học sinh quan sát thí nghiệm thả viên phấn không có bảo vệ để tạo tình huống có vấn đề.2. Giao nhiệm vụ (5 phút)- Yêu cầu học sinh: “Hãy thiết kế một thiết bị đơn giản để ngăn viên phấn bị vỡ khi rơi từ độ cao 3 mét.”3. Làm việc nhóm – Thiết kế và chế tạo (30 phút)- Học sinh chia nhóm, thảo luận và thực hiện thiết kế.- Vật liệu cung cấp: giấy báo, băng keo, ống hút, dây thun, bọt biển, hộp carton nhỏ, bóng bay, túi nilon... - Giáo viên hỗ trợ, gợi ý và đặt câu hỏi thêm: ""Tại sao con chọn vật liệu này? Thiết bị của con sẽ làm giảm lực va chạm như thế nào? Con có nghĩ đến việc bảo vệ phấn từ các cạnh không?"" ""Tại sao con chọn vật liệu này? Thiết bị của con sẽ làm giảm lực va chạm như thế nào? Con có nghĩ đến việc bảo vệ phấn từ các cạnh không?""...4. Thử nghiệm và cải tiến (15 phút)- Mỗi nhóm sẽ trình bày thiết bị của mình . Sau đó tiến hành thử nghiệm. Chọn một khu vực an toàn, mỗi nhóm thử thả thiết bị từ độ cao 3 mét, quan sát, ghi chép kết quả.- Thảo luận: - ""Viên phấn của nhóm nào vẫn còn nguyên vẹn? Tại sao?""- ""Thiết bị nào hoạt động hiệu quả nhất? Vì sao?""- ""Chúng ta có thể cải thiện thiết bị như thế nào?""- ""Bài học nào các em rút ra từ hoạt động này?"" (Về vật liệu, cấu trúc, lực).5. Trình bày và tổng kết (10 phút)- Các nhóm trình bày sản phẩm và giải thích nguyên lý hoạt động.- Giáo viên chốt lại kiến thức bài học về độ bền của vật liệu và cấu trúc thiết kế qua trải nghiệm thực tế."
S006,Q4,0.25,"The answer has a clear introduction, body and conclusion, but the flow is natural and not overly rigid; it lacks the mechanical 1‑sentence‑per‑idea style typical of AI templates. The language is varied and context‑specific, with mixed sentence lengths and a range of vocabulary that suggests a human writer. Although the peer similarity score of 0.42 indicates some overlap with other students’ work, the AI similarity score of 0.00 and the overall narrative style make it unlikely that a standard AI model produced this text. The symbolic score of 1.00 may reflect the use of formal markers (e.g., bullet points, headings) rather than template‑driven syntax. For these reasons the AI‑likeness is judged low (≈0.25).","Khi tham gia các hoạt động nghệ thuật trong STEAM, nhiều học sinh thường bối rối hoặc lo lắng vì không biết bắt đầu từ đâu. Do đó, giáo viên đóng vai trò quan trọng trong việc cung cấp tài liệu tham khảo mang tính định hướng, nhưng không ràng buộc tư duy sáng tạo của học sinh. Nếu một học sinh yêu cầu “xem ví dụ”, tôi sẽ chuẩn bị sẵn bộ sưu tập hình ảnh minh họa đa dạng – không phải là mẫu chuẩn để sao chép, mà là những gợi ý về màu sắc, chất liệu, kỹ thuật hoặc phong cách trình bày. Những hình ảnh này được lựa chọn kỹ để khơi gợi trí tưởng tượng và tạo cảm hứng, đồng thời giảm bớt áp lực cho học sinh khi bắt đầu.Sau khi học sinh xem tài liệu tham khảo, tôi sẽ đặt câu hỏi khơi mở như:- “Em thích chi tiết nào trong những ví dụ này?”- “Nếu làm theo cách riêng, em sẽ thay đổi điều gì?”- “Sản phẩm của em sẽ mang thông điệp gì?”Giáo viên tạo không khí an toàn sáng tạo và Hỗ trợ từng bước nhỏ. Nếu học sinh vẫn lúng túng, thì chia nhỏ quy trình sáng tạo: phác thảo ý tưởng, chọn màu sắc, lựa vật liệu... Điều này giúp giảm áp lực và tạo cảm giác “em có thể làm được”.Cách tiếp cận này kết hợp giữa định hướng và tự do sáng tạo, giúp học sinh cảm thấy an toàn khi thử nghiệm, đồng thời vẫn khuyến khích phát triển ý tưởng độc lập. Đây là điều cốt lõi trong giáo dục STEAM: học sinh không chỉ làm theo, mà phải sáng tạo, khám phá và thể hiện cá tính riêng của mình."
