student_id,question,ai_likeness_score,ai_likeness_comment,answer_text
S006,Q5,0.45,"Answer shows a highly organized structure with clear headings, bullet lists, and numeric rubrics, which can be characteristic of an AI‑generated template. However, the AI similarity score is 0.00, indicating no direct overlap with known AI model outputs, and the content is quite specific to a Vietnamese lesson plan context. Peer similarity is moderate (0.34), suggesting some common phrasing among students but not a clear template reuse. Overall, the balance of strong structural features and lack of direct AI overlap results in a moderate likelihood of AI‑style templating.","Hoạt động dạy học :MÔN: CÔNG NGHỆ - LỚP 4CHẬU CÂY TÁI CHẾ -- GÓC XANH SÁNG TẠO (2 TIẾT)Mô tả bài học: Hiểu được vai trò của cây xanh trong cuộc sống và môi trường. Biết tái sử dụng chai nhựa/thùng sữa/hộp giấy... để tạo ra chậu cây thân thiện với môi trường. Trồng và chăm sóc một số loại hoa và cây cảnh. Rèn luyện kỹ năng quan sát, làm việc nhóm, tư duy thiết kế và sáng tạo.II. Nội dung chủ đạo và tích hợpNội dung chủ đạo và tích hợp trong bài họcMôn họcYêu cầu cần đạtMôn học chủ đạoCông nghệ- Trình bày được đặc điểm của một số loại chậu trồng hoa và cây cảnh.- Trồng và chăm sóc được một số loại hoa và cây cảnh trong chậu.Môn học tích hợpToán- Sử dụng được một số dụng cụ thông dụng để thực hành cân, đo, đong, đếm.Khoa học- Hiểu thực vật sống và phát triển cần đủ yếu tố: Nước, ánh sáng, chất khoáng, không khí.Mĩ thuật- Phối hợp được một số kĩ năng: cắt, xé, dán, vẽ, in, ghép, nặn, uốn...trong thực hành, sáng tạo.III. YÊU CẦU CẦN ĐẠT- Lựa chọn vật liệu và sử dụng các dụng cụ để làm và trang trí chậu. - Tóm tắt được nội dung các bước trồng hoa, cây cảnh trong chậu. - Trồng được một chậu hoa trang trí lớp học theo chủ đề.- Thực hiện được việc ước lượng số đo trong một số trường hợp đơn giản. - Thể hiện tự tin khi trình bày ý kiến thảo luận, đề xuất ý tưởng, giới thiệu sản phẩm. - Từ đó hình thành và phát triển những năng lực chung và phẩm chất chủ yếu. - GDBVMT: GD học sinh yêu thiên nhiên, biết chăm sóc và bảo vệ cây xanh, bảo vệ môi trường sống.IV. ĐỒ DÙNG DẠY HỌC Chuẩn bị của GV– Rubrics đánh giá sản phẩm. Phiếu học tập.2. Chuẩn bị của HS:  Chai nhựa, lon sữa, hộp giấy đã qua sử dụng. Kéo, dao rọc giấy (có sự giám sát của giáo viên). Màu vẽ, giấy màu, băng keo. Đất trồng, hạt giống hoặc cây con nhỏ.V. CÁC HOẠT ĐỘNG DẠY HỌC CHỦ YẾUHOẠT ĐỘNG DẠY HỌCYÊU CẦU CẦN ĐẠTĐIỀU CHỈNHA. Khởi động (3 phút)- Giáo viên cho học sinh xem một đoạn video ngắn về ô nhiễm rác thải nhựa và tác động tích cực của cây xanh.”- GV hỏi hs: “Nội dung của video nói lên điều gì?”- Hs trả lời, nhận xét- GV chốt, chuyển ýTạo động cơ học tập tốt về thực hiện hoạt động học tập.B. Luyện tập – vận dụng (30 phút)Hoạt động 1: Đề xuất ý tưởng làm chậu cây và nêu tiêu chí.- Tìm hiểu các chậu cây.- Yêu cầu hs nêu lại các tiêu chí của chậu trồng cây- Tổ chức hs thảo luận nhóm 6 - trình bày ý tưởng của nhóm về cách làm chậu và trang trí, chọn cây và đưa ra tiêu chí cho nhóm mình.- GV mời đại diện nhóm chia sẻ và nêu các tiêu chí.- HS các nhóm bổ sung, nhận xét.- GV nhận xét, thống nhất tiêu chí chung cho cả lớp.- HS nhắc lại các tiêu chí.( Có lỗ thoát nước; Chậu chắc chắn, Tính sáng tạo và thẩm mỹ, Tính tái chế và thân thiện môi trường)HS đưa ra các ý tưởng và tiêu chí trang trí chậu cây.Hoạt động 2: Thực hiện làm chậu, trang trí chậu cây và trồng cây.* Chế tạo và thử nghiệm- GV tổ chức cho HS sử dụng chai nhựa/hộp sữa cũ, cắt và tạo hình thành chậu cây, trang trí chậu cây bằng màu nước, giấy màu, mắt dán, hình vẽ sinh động để tạo sản phẩm bắt mắt. và trồng cây vào chậu theo nhóm 6 (8 phút).- GV quan sát, hỗ trợ các nhóm gặp khó khăn.* Đánh giá và cải tiếnGV phát phiếu đánh giá và yêu cầu HS tự đánh giá sản phẩm tương ứng với những việc em đã làm.RUBRICS ĐÁNH GIÁ – CHẬU CÂY TÁI CHẾ (Tổng điểm: 10)Tiêu chí1 điểm2 điểm1. Sáng tạo – Thẩm mỹTrang trí đơn giản, thiếu điểm nhấnThiết kế độc đáo, trang trí sinh động2. Tái chế – Bảo vệ môi trườngDùng ít vật liệu tái chế, chưa thân thiệnSử dụng hoàn toàn vật liệu tái chế, thân thiện môi trường3. Kỹ thuật – Khả năng sử dụngChậu yếu, không có lỗ thoát nướcChậu chắc chắn, có lỗ thoát nước, phù hợp cây trồng4. Chăm sóc và ghi chépCây không sống hoặc không ghi chépCây sống tốt, có bảng theo dõi phát triển5. Trình bày – Hiểu biếtTrình bày chưa rõ, chưa hiểu rõ sản phẩmTrình bày tự tin, hiểu về cây, vật liệu và ý nghĩa tái chếXếp loại: 9–10 điểm: Tốt. 7–8 điểm: Đạt yêu cầu. 5–6 điểm: Cần cải thiện. &lt;5 điểm: Cần hỗ trợ thêm- Các nhóm hoàn thành sản phẩm, GV yêu cầu các nhóm kiểm tra điều chỉnh sản phẩm theo các tiêu chí.- Cả lớp nhận xét, góp ý cho nhóm bạn.- GV tổng kết hoạt động chuyển sang hoạt động tiếp theo.Biết lựa chọn vật liệu tái chế để làm chậu cây, sử dụng các dụng cụ để thực hiện trang trí chậu.Học sinh tự đánh giáHoạt động 3: Giới thiệu và trưng bày sản phẩm - Học sinh giới thiệu về sản phẩm.- HS trưng bày sản phẩm và bảng thuyết trình.GV tổ chức cho các nhóm đánh giá đồng đẳng, trao đổi để xin ý kiến của bạn về sản phẩm của nhóm mình đã làm.- HS nhận xét và đánh giá kết quả.- GV cho HS bình chọn sản phẩm của các nhóm bạn.- GV nhận xét, tuyên dương.Thể hiện tự tin khi trình bày ý kiến thảo luận, đề xuất ý tưởng, giới thiệu sản phẩm.C. Tổng kết (2 phút)Tổ chức Góc xanh trong lớp học.Học sinh đem cây về nhà chăm sóc và theo dõi trong 2–3 tuần.Kết nối bài học về môi trường, biến đổi khí hậu, thực vật...Khắc sâu lại kiến thức cho học sinh liên hệ bản thân bảo vệ môi trường.Tích hợp hoạt động “Chậu cây tái chế - góc xanh sáng tạo” vào chương trình GDPT 2018. Áp dụng cho môn Tự nhiên và Xã hội (lớp 1, 2, 3) và Khoa học (lớp 4, 5).Bộ sáchLớpMôn họcChủ đề / Tên bài họcGợi ý tích hợp làm chậu cây tái chế (STEAM)Chân trời sáng tạo1Tự nhiên &amp; Xã hộiBài 17: Giữ gìn vệ sinh môi trườngThiết kế và làm chậu cây tái chế, nâng cao ý thức bảo vệ môi trường2Tự nhiên &amp; Xã hộiBài 19: Bảo vệ môi trườngThực hành làm và trang trí chậu cây từ chai nhựa, học về tái chế và bảo vệ môi trường3Tự nhiên &amp; Xã hộiBài 24: Bảo vệ môi trườngSáng tạo sản phẩm tái chế, thảo luận lợi ích tái sử dụng vật liệu4Khoa họcBài 22: Thực vật cần gì để sống?Làm và trang trí chậu cây tái chế. Trồng cây trong chậu tái chế, quan sát điều kiện sống của cây4Khoa họcBài 25: Điều kiện sống của câyTheo dõi và ghi chép sự phát triển của cây trồng trong chậu tái chế5Khoa họcBài 26: Bảo vệ môi trườngDự án làm chậu cây từ chai nhựa tái chế, sáng tạo và trang trí chậu cây, tìm hiểu ý nghĩa bảo vệ môi trườngKết nối tri thức1Tự nhiên &amp; Xã hộiBài 16: Giữ gìn môi trường xung quanhLàm và trang trí chậu cây tái chế để trang trí lớp, giáo dục ý thức bảo vệ môi trường2Tự nhiên &amp; Xã hộiBài 17: Một số việc nên làm để bảo vệ môi trườngHoạt động làm chậu cây từ chai nhựa tái chế, sáng tạo trang trí chậu cây3Tự nhiên &amp; Xã hộiBài 22: Tài nguyên thiên nhiên và con ngườiGiới thiệu ý tưởng tái chế chai nhựa để bảo vệ tài nguyên thiên nhiên. Tự do trang trí sáng tạo theo ý tưởng.4Khoa họcBài 25: Điều kiện sống của câyTrồng cây trong chậu tái chế và quan sát.5Khoa họcBài 27: Tài nguyên và cách bảo vệThiết kế sản phẩm tái chế từ chai nhựa làm chậu cây. Tự do trang trí sáng tạo theo ý tưởng.Cánh diều1Tự nhiên &amp; Xã hộiBài 15: Giữ gìn vệ sinh nơi công cộngLàm chậu cây tái chế trang trí lớp, nâng cao ý thức cá nhân về môi trường. Tự do trang trí sáng tạo chậu cây theo ý tưởng.2Tự nhiên &amp; Xã hộiBài 18: Giữ gìn và bảo vệ môi trường sốngLàm chậu cây từ chai nhựa, minh họa hành động bảo vệ môi trường. Tự do trang trí chậu cây sáng tạo theo ý tưởng.3Tự nhiên &amp; Xã hộiBài 23: Trách nhiệm bảo vệ môi trườngTrình bày sản phẩm tái chế, thảo luận về ý nghĩa bảo vệ môi trường. Tự do trang trí sáng tạo theo ý tưởng.4Khoa họcBài 22: Thực vật cần gì để sống?Thực hiện làm chậu c6y tái chế và Tự do trang trí sáng tạo theo ý tưởng.Trồng cây trong chậu tái chế, ghi chép tìm hiểu điều kiện sống của cây5Khoa họcBài 25: Bảo vệ môi trường sốngDự án học tập dùng vật liệu tái chế bảo vệ môi trường. Tự do trang trí sáng tạo theo ý tưởng."
S007,Q1,0.2,"The answer shows only mild indications of AI‑like templating. The structure (introduction, bullet‑point list, example) is common in both human and AI responses, but the language is fairly natural and lacks the highly formulaic phrasing often seen in generated text. The peer similarity of 0.30 suggests some overlap with other students' work, which is typical of human writing. The symbolic_score of 1.00 likely reflects the use of bullet points rather than genuinely AI‑generated patterns. Overall, the response does not exhibit strong signs of a templated AI output.","""Học tập trải nghiệm” là hình thức dạy học nhằm tổ chức hoạt động giúp cho HS chủ động tìm hiểu kiến thức thông qua các hoạt động trải nghiệm hoặc được khai thác, vận dụng các kiến thức vốn có để thực hành làm sản phẩm, vận dụng vào cuộc sống thực tiễn.Tác động của học tập trải nghiệm đối với HS là:- HS học đi đôi với hành.- HS học thông qua chơi.- HS học tập cảm thấy vui vẻ, tích cực, phù hợp với tâm lý lứa tuổi.- HS chủ động tham gia vào giờ học- HS được trải nghiệm, khám phá, được khai thác những kiến thức vốn có để tạo thành kiến thức mới. Và đặc biệt là các em biết kiến thức ấy cần để làm gì, học để làm gì?- HS yêu thích học tập, tự nghiên cứu, khám phá và hình thành được nhiều kiến thức cho bản thân, trở thành người có ích cho tương lai.Ví dụ: Khi học bài “Xếp hình” - môn Toán lớp 1, HS ban đầu hiểu đây là dạng trò chơi lắp ghép như lego. Nhưng khi GV dạy học theo hướng trải nghiệm, HS sẽ được vận dụng kiến thức vào thực tiễn, cùng xếp hình làm sản phẩm Gấp áo. Đó không chỉ là kiến thức nữa mà là sự trải nghiệm, vận dụng có hiệu quả kiến thức trong cuộc sống hằng ngày."
S007,Q2,0.3,"The response shows a clear, instructional structure with sections and bullet‑like phrasing, but the language is natural Vietnamese with minimal use of typical AI‑generated formal hooks or repetitive phrasing. The AI similarity score is 0.00, indicating no direct overlap with known AI templates. Peer similarity is modest (0.24) and the symbolic score (1.00) reflects the use of structured formatting common in lesson plans, not uniquely AI. Overall, the text does not exhibit the highly uniform style, generic positive bias, or formulaic expression often seen in AI‑generated templates, hence the relatively low AI likeness score.","Khi HS học về xem lịch lớp 1 tạo sự hào hứng khi được làm Tờ lịch sáng tạo.Minh họaHoạt động dạy họcKĩ năng HSHoạt động: Tìm hiểu về tờ lịch và thực hành làm sản phẩm- HS xem tờ lịch và trao đổi để tìm ra thứ, ngày – tháng.- HS đưa ra ý kiến.a) Đề xuất và lựa chọn giải pháp* Tìm hiểu về tờ lịch sáng tạo- HS quan sát mẫu tờ lịch và trả lời:Sản phẩm có hình gì?Sản phẩm được làm từ những vật liệu nào?HS chọn vật liệu và dụng cụ.Thực hành:HS xem clip hướng dẫn à nêu các bước làm sản phẩm.HS thống nhất tiêu chí của Tờ lịchb) Chế tạo sản phẩm- HS làm sản phẩm theo nhóm 4.Chia sẻ - Đánh giáTham quan sản phẩm à trình bày ý kiến.HS bình chọn sản phẩm đẹp, đáp ứng các tiêu chí.HS nêu hướng cải tiến, nêu ý nghĩa của tờ lịch.Kĩ năng quan sát, vận dụng kiến thức vốn cóKĩ năng quản lí thời gianKĩ năng giao tiếp - hợp tác.Kĩ năng giao tiếp - hợp tác, mô hình hóa, lên ý tưởng sáng tạo.Kĩ năng chia sẻ, khắc phục khi được góp ý.Kĩ năng phản hồi: Vận dụng sau bài học"
S007,Q3,0.1,"The response shows a clear, lesson‑plan structure (activities, sub‑steps) that is common in classroom settings, but it lacks the typical AI‑generated markers such as high similarity to known AI templates or overly formal phrasing. The AI similarity score is 0.00, indicating no direct overlap with the AI model’s reference output. Peer similarity is modest (0.27), suggesting some commonality with classmates but not a large overlap. The text uses a straightforward Vietnamese instructional tone, with consistent sentence length and vocabulary that match a human teacher’s style rather than an AI’s uniform pattern. Overall, the probability that this is a generative‑AI template is very low, hence the low score.","Tôi áp dụng bài học cho HS lớp 3:Hoạt động 1: Tình huống có vấn đề:Đặt tình huống: Phấn của lớp mình thường bị rơi rớt và gãy vụng. Vậy các em có suy nghĩ nên làm một thiết bị nào để ngăn viên phấn không bị vỡ khi được thả từ độ cao 3 mét không?GV cùng HS đặt ra các tiêu chí cho dụng cụ:1/ Có tác dụng để ngăn viên phấn không bị vỡ khi được thả từ độ cao 3 mét 2/ Được làm tự nguyên liêu dễ tìm3/ Phải chắc chắn, dùng nhiều lần Hoạt động 2: Thực hành làm sản phẩm a/ Đề xuất ý tưởng làm sản phẩmQuan sát thiết bị mẫu: Thiết bị có dạng hình gì? Được làm từ những nguyên vật liệu nào?Thảo luận vẽ ý tưởng lên giấy theo nhóm 4 và trình bày ý tưởngb) Thực hành:Nhóm chọn vật liệu theo bản thiết kế+ Các hộp hình khối có sẵn+ Các miếng bìa carton+ Keo dán+ Bút màu+ Nilong+ Ống nhựaHS làm sản phẩm theo nhóm 4Hoạt động 3: Thí nghiệm thả viên phấnHS cùng thả viên phấn để kiểm nghiệm sản phẩmBình chọn sản phẩm có hiệu quả nhấtCải tiến sản phẩm sau bài học."
S007,Q4,0.3,"The response shows modest signs of AI-like template usage. The structure is loosely organized but lacks a clear introductory and concluding paragraph; the content flows directly from a general idea to a specific activity. There are no overtly stereotypical AI phrasings, and the language is relatively simple, with varied sentence lengths, suggesting a human writer. The high symbolic_score (1.0) indicates frequent use of symbolic or formal elements (e.g., bullet-like lists, structured numbering), which can be a hallmark of template-based answers, but combined with the zero AI similarity score and moderate peer similarity, the overall likelihood of an AI-generated template remains low. Thus, the score is set to 0.3.","Nếu một học sinh yêu cầu 'xem ví dụ' liên quan việc tạo ra các sản phẩm có yếu tố nghệ thuật độc đáo, tôi sẽ cho HS xem và thực hiện sản phẩm “Những bức tranh cầu vồng” khi học tập vận dụng bài học về Số 7 - Lớp 1.Các em học các kiến thức về số 7: tập đếm số từ 1 đến 7 và tạo sản phẩm Cầu vồng bằng sự sáng tạo khi lựa chọn các vật liệu: bút màu, giấy màu, bông gòn, keo dán.... Các vật liệu được sắp xếp một cách có nghệ thuật để tạo nên một bức tranh hài hoà về thẩm mĩ nhưng đúng về thực tế. HS được vận dụng trí sáng tạo, được khai thác những hiểu biết không chỉ về toán học mà còn về tự nhiên và xã hội và chính tay tạo sản phẩm để trang trí lớp học của mình. Hoàn thành và sử dụng sản phẩm để trang trí lớp"
S007,Q5,0.1,"The answer exhibits a simple, student‑style outline with specific project details and no obvious introduction‑body‑conclusion framing, minimal use of generic AI phrasing, consistent but short sentences, and unique content not repeated by other students. These factors make it unlikely to be a templated AI response.","Dựa vào môn Công nghệ 3:Làm đồ chơi hoặc môn Khoa học 5: Năng lượng gió, mặt trời và nước chảyHoạt động 1: Tình huống có vấn đề:Việt Nam có số lượng xe máy rất nhiều nên tình trạng ô nhiễm môi trường vẫn đang diễn ra. Để thay thế xăng dầu cho các phương tiện, chúng ta có thể sử dụng năng lượng nào? Giới thiệu: Ngoài năng lượng mặt trời, điện, ta có thể sử dụng năng lượng gió... Thiết kế mô hình xe đa năng.HS đặt ra tiêu chí cho xe đa năng: 1/ Có thể chạy được.2/ Được làm tự nguyên liệu tái chế. 3/ Phải chắc chắn, sử dụng được lâu.Hoạt động 2: Thực hành:a/ Đề xuất ý tưởng:- Quan sát mô hình xe: Mô hình có dạng những hình gì? Được làm từ vật liệu nào? Xe hoạt động như thế nào?- Thảo luận, vẽ ý tưởng lên giấy theo nhóm 4 và trình bày ý tưởngb) Thực hành:- HS chọn vật liệu theo bản thiết kế+ Bìa carton: tròn, chữ nhật...+ Bong bóng+ Ống hút+ Keo dán+ Bút màu+ Que gỗHS làm sản phẩm theo nhóm 4Hoạt động 3: Thí nghiệm thả viên phấn- Tham gia “ Đua xe F1” à Thử nghiệm chiếc xe nào chạy nhanh nhất: bình chọn nhóm chiến thắng.- Cải tiến sản phẩm sau bài học."
S008,Q1,0.25,構造化は序論・本論・結論が明確に分かれているものの、文章全体が極端に整いすぎているわけではなく、一般的な人間の説明文に近い。定型表現としては「Thứ nhất」「Thứ hai」「Điều này giúp」といった順序を示す語句が使われており、AIがよく用いる表現のパターンが若干見られるが、語彙の幅や語調に大きな均一性はない。具体例は実験の設定という典型的なものだが、他の学生と大きく重複しているわけではなく、同じような内容を持つ学生が多いという事実はpeer_similarity_score 0.40で示されている。総合すると、AIテンプレート的な回答というよりは、人間が構成した説明文に近く、AIっぽさは低めと判断した。,"""Học tập qua trải nghiệm"" là phương pháp giáo dục mà học sinh trực tiếp sử dụng các giác quan để học tập trong suốt quá trình, thông qua các hoạt động thực tế thay vì chỉ học tập lý thuyết một chiều. Điều này giúp học sinh phát triển kỹ năng tư duy phản biện, khả năng giải quyết vấn đề và tăng cường sự sáng tạo. Tác động của phương pháp này đến học sinh rất lớn. Thứ nhất, nó tạo ra sự hứng thú và động lực học tập. Khi tham gia vào các hoạt động thực tế, học sinh dễ dàng kết nối kiến thức với cuộc sống hằng ngày. Thứ hai, học sinh phát triển khả năng làm việc nhóm và giao tiếp, vì họ thường phải hợp tác với nhau để hoàn thành nhiệm vụ.Ví dụ cụ thể: học sinh có thể thực hiện thí nghiệm để khám phá các khái niệm về lực và chuyển động (Sử dụng một chiếc xe đẩy nhẹ và một số vật nặng như sách. Sau đó đẩy xe với vài lực khác nhau và quan sát sự thay đổi về tốc độ rồi học sinh ghi nhận ảnh hưởng của lực đến chuyển động. Hay ở một ví dụ khác, học sinh lăn một quả bóng trên các bề mặt khác nhau như gạch, cỏ, nhựa rồi so sánh và giải thích tại sao bóng lăn xa hơn trên bề mặt mịn.) Thay vì chỉ đọc sách, việc tự tay thực hiện thí nghiệm giúp các em hiểu sâu hơn về lý thuyết và ghi nhớ lâu hơn. Từ đó, học sinh không chỉ học kiến thức mà còn hình thành thái độ tích cực đối với việc học."
S008,Q2,0.18,"The answer shows a clear, logically organized flow (introduction, body, conclusion) but this structure alone does not imply AI generation. The content uses natural Vietnamese phrasing, lacking the characteristic formulaic expressions or positive bias often found in template‑based AI responses. The AI similarity score of 0.00 indicates no detected overlap with known AI samples, suggesting a low probability of AI authorship. The peer similarity of 0.32 indicates moderate commonality with other student responses, which is typical for collaborative assignments. Overall, the linguistic style is varied, with differing sentence lengths and vocabulary, and the concrete examples are plausible for a student’s original plan, not overly generic or templated. Thus, the likelihood of an AI‑generated template is low, reflected in the modest score of 0.18.","Hoạt động: ""Góc Kĩ năng sống""Mục đích : Phát triển kĩ năng sống thiết yếu cho học sinh.Mô tả hoạt động : Học sinh sẽ tạo ra một sản phẩm ""Góc Kĩ năng sống"" trong lớp để học hỏi và chia sẻ quan điểm với nhau. Mỗi tháng, một tổ sẽ thiết kế một poster trình bày ngắn gọn về một kỹ năng cụ thể như: Kĩ năng nấu ăn, kĩ năng quản lý tiền tiết kiệm hoặc kĩ năng giao tiếp Tiếng Anh với người nước ngoài. Các em có thể sử dụng video sưu tầm, hình ảnh, thực hành cắt dán hoặc vẽ trực tiếp lên poster. Sau đó trình bày ý tưởng của mình, lớp sẽ tham gia thảo luận học hỏi và đóng góp ý kiến.Ví dụ: Nếu tổ Một chọn ""Kĩ năng nấu ăn"", các em có thể dán hình ảnh mô tả món ăn đơn giản và quá trình chuẩn bị rồi đến các bước nấu ăn, nêm nếm. Nếu tổ Hai chọn ""Kĩ năng quản lý tiền tiết kiệm"", các em có thể chia sẻ cách làm ống heo tiết kiệm, cân nhắc sử dụng tiền để mua sắm hợp lí hơn nhằm tiết kiệm.Kỹ năng mong muốn học sinh phát triển :Kỹ năng thực hành : Học sinh sẽ vận dụng trải nghiệm của bản thân vào thiết kế poster. Giao tiếp tiếp : Các cải tiến về khả năng trình bày có bố cục rõ ràng và thuyết phục.Làm việc nhóm : Học tập hiệu quả trong quá trình chuẩn bị và thực hiện.Tư duy phản biện : Thảo luận và phản biện giúp các em rèn luyện khả năng tư duy logic.""Góc Kĩ năng sống"" không chỉ làm phong phú thêm ý tưởng học tập thông qua trải nghiệm mà còn mang lại học sinh những kĩ năng cần thiết trong cuộc sống hàng ngày.Một số hình ảnh minh họa poster về Góc Tiếng Việt"
