student_id,question,ai_likeness_score,ai_likeness_comment,answer_text
S001,Q1,0.25,構造化は整ったものの、序論・本論・結論の分かれ方が自然で、AIがよく使う極端にテンプレート化された構成（例：『まずは～、次に～、最後に～』という決まり文句）ほど強くは見られない。定型表現は少なく、ポジティブバイアスはややあるものの、過度にフレンドリーな言い回しや共通語彙の羅列は目立たない。文体の均一性は比較的安定しており、長短のバランスが保たれ、語彙も多様である。具体例は特定の教科書と課題に基づく詳細な記述で、他の学生と類似点がある程度あるものの、典型的すぎるというよりは実践的な説明が多い。したがって、生成AIによるテンプレート的解答である可能性は低め（0.25）と判断した。,"Khái niệm “Học tập qua trải nghiệm”: Là một phương pháp học tập trong đó học sinh chủ động tham gia vào quá trình học thông qua việc trải nghiệm thực tế, thực hành, khám phá và phản tư (suy ngẫm lại những gì đã làm và học được). Thay vì chỉ tiếp thu kiến thức qua sách vở hay bài giảng, các em học sinh được tự mình thực hiện, thử nghiệm và rút ra bài học từ chính trải nghiệm cá nhân. Đây là cách học giúp kiến thức trở nên sống động, dễ hiểu và khó quên hơn. Tác động của học tập qua trải nghiệm đến học sinh: Tăng hứng thú và động lực học tập: Khi học sinh được ""làm thật"", các em cảm thấy việc học trở nên gần gũi, thú vị hơn, từ đó chủ động hơn trong quá trình học. Phát triển tư duy phản biện và giải quyết vấn đề: Trải nghiệm thực tế thường đi kèm với những tình huống phức tạp, đòi hỏi học sinh phải quan sát, phân tích, đưa ra quyết định và thử nghiệm các giải pháp khác nhau. Nâng cao kỹ năng hợp tác và giao tiếp: Nhiều hoạt động trải nghiệm yêu cầu học sinh làm việc theo nhóm, từ đó các em học cách lắng nghe, trao đổi và làm việc hiệu quả với người khác. Liên hệ kiến thức với thực tế: Học sinh hiểu rõ hơn về ý nghĩa của những gì mình học, vì các kiến thức được ứng dụng trực tiếp trong các tình huống cụ thể, thực tế. Dẫn chứng ví dụ minh hoạ: Môn Khoa học – Lớp 4 (Bộ sách Chân trời sáng tạo) Bài 8. Nguồn sáng và sự truyền ánh sáng (trang 34). Hoạt động: Tổ chức cho học sinh lắp ráp một mạch điện đơn giản để tạo ra nguồn sáng. Khi tìm hiểu về nguồn sáng, giáo viên có thể tổ chức hoạt động trải nghiệm cho học sinh tự lắp ráp một mạch điện đơn giản để tạo ra nguồn sáng. Mục tiêu của hoạt động: + Giúp học sinh nhận biết được khái niệm nguồn sáng và hiểu được cách ánh sáng được tạo ra từ nguồn điện. + Củng cố kiến thức về sơ đồ mạch điện đơn giản và nguyên lý hoạt động của một số thiết bị điện đơn giản trong thực tiễn. + Phát triển năng lực tự học, hợp tác nhóm và vận dụng kiến thức vào thực tiễn. Hình thức tổ chức: Giáo viên chia lớp thành các nhóm nhỏ. Mỗi nhóm được phát dụng cụ: pin, dây điện, bóng đèn nhỏ, công tắc, băng dính. Học sinh tự lắp ráp mạch điện theo sơ đồ đơn giản để làm thành một chiếc đèn pin mini. Sau khi lắp ráp xong, các nhóm thử bật/tắt đèn, quan sát ánh sáng phát ra và thảo luận: + Nguồn sáng trong mạch điện này là gì? + Ánh sáng truyền đi theo đường nào? + Nếu ngắt công tắc, chuyện gì xảy ra? Kết luận: Qua hoạt động trải nghiệm này, học sinh không chỉ hiểu rõ hơn về nguồn sáng và sự truyền ánh sáng mà còn biết cách ứng dụng kiến thức để tạo ra thiết bị đơn giản phục vụ cuộc sống. Đồng thời, giúp các em rèn kỹ năng thực hành, làm việc nhóm và tư duy khoa học, khắc sâu kiến thức, vận dụng có hiệu quả các kiến thức đã học vào thực tiễn cuộc sống."
S001,Q2,0.2,"The response displays a natural, instructional structure with detailed content that aligns closely with a human lesson plan. It lacks the rigid, formulaic style and repetitive phrasing typical of AI‑generated templates, reflected in the zero AI‑similarity score. Although the symbolic score is high—indicating many numeric and symbolic elements—it does not signify AI origin. The moderate peer similarity suggests shared classroom conventions rather than AI templating. Overall, the likelihood that this is a generated AI template is low.","Môn Toán 4 (Bộ sách Chân trời sáng tạo) Bài 21. Em làm được những gì? (Trang 67) Hoạt động: Thực hành – Vận dụng I. Mục tiêu: Củng cố và khắc sâu kiến thức về cấu tạo số có sáu chữ số. Nhận biết hàng và lớp trong số tự nhiên. Phát triển kỹ năng tư duy logic, phân tích dữ kiện và giao tiếp hợp tác nhóm. Khơi gợi sự tò mò, thích thú, tạo không khí thoải mái trong lớp học Toán. II. Tiến trình baì dạy Khởi động: Trò chơi “Đi tìm ẩn số” 1.1. Đặt vấn đề (tình huống mở): “Hôm qua, thầy có mua một cái ổ khóa có mật mã gồm 5 chữ số. Nhưng thầy đã làm lạc mất tờ giấy ghi mật mã. Thầy chỉ nhớ rằng: Chữ số ở hàng chục nghìn KHÔNG phải là số 2. Chữ số ở hàng đơn vị là một số lẻ. * Nhiệm vụ của học sinh: Làm việc cá nhân hoặc theo cặp để phân tích từng đáp án, từ đó loại trừ và lựa chọn đáp án đúng. Gợi ý đáp án: 2540004-1780823 789 → chữ số hàng chục nghìn là 2 ❌ (loại) 2425704-1574652 758 → hàng đơn vị là 8 (số chẵn) ❌ (loại) 3556004-1395758 217 → hàng chục nghìn ≠ 2, hàng đơn vị là 7 (số lẻ) ✅ (đúng) 2400304-2132785 214 → hàng đơn vị = 4 (số chẵn) ❌ (loại) Vậy đáp án đúng là: c. 58 217 2. Thực hành – Vận dụng 2.1. Các nhóm quan sát ổ khoá thảo luận và đề xuất ý tưởng










2.2. Nêu các tiêu chí của sản phẩm. Sử dụng để lập các số có 6 chữ số. Mỗi hàng được trình bày trên một cột, bao gồm hình vẽ và chú thích về hàng đó. Các chữ số được viết rõ ràng, đảm bảo tính thẩm mĩ. Chắc chắn, dễ sử dụng. 3534414-109748











Lên ý tưởng – Thiết kế chi tiết + Nhóm sử dụng vật liệu gì để làm sản phẩm? + Sản phẩm gồm những bộ phận nào? + Cách làm sản phẩm như thế nào? + Công dụng của sản phẩm đó là gì? Các nhóm chia sẻ ý tưởng. Các nhóm thảo luận – Phân công nhiệm vụ Chế tạo và thử nghiệm Chia sẻ, thuyết minh về sản phẩm Vận dụng Sử dụng bộ chữ số lập nhanh các số sau: a. Số lớn nhất có 6 chữ số Số gồm 3 trăm nghìn, 4 chục nghìn, 6 nghìn, 5 trăm, 8 chục và 2 đơn vị. Số gồm 5 trăm nghìn, 2 chục nghìn, 4 nghìn, 1 trăm, 3 chục và 7 đơn vị. Hãy nêu giá trị của chữ số 5 trong số 258 139 2.9. Đánh giá, cải tiến sản phẩm 3. Học sinh chia sẻ những kiến thức về STEAM mà các em đã tiếp thu được qua bài học. * Các kỹ năng phát triển cho học sinh thông qua các hoạt động trên. Tư duy logic và giải quyết vấn đề Các em phải suy luận, tìm quy luật và thử nghiệm các cách sắp xếp khác nhau để tạo ra bộ chữ số bí ẩn đúng yêu cầu. Khả năng đặt giả thiết và kiểm tra giả thiết thông qua thực hành. Kỹ năng vận dụng kiến thức toán học vào thực tiễn Ứng dụng kiến thức về cấu tạo số, hàng và lớp của các số tự nhiên trong việc chế tạo và kiểm tra bộ chữ số. Rèn luyện khả năng tính toán nhanh, chính xác và liên hệ số học vào trò chơi, mô hình thực tế. Kỹ năng làm việc nhóm và giao tiếp Các em được khuyến khích thảo luận, chia sẻ ý tưởng, phân công nhiệm vụ và cùng nhau giải quyết thử thách. Phát triển khả năng lắng nghe, trình bày ý tưởng và tiếp nhận ý kiến phản hồi. Kỹ năng sáng tạo và thiết kế Các em không chỉ tìm ra bộ chữ số đúng mà còn được tự tay thiết kế, trang trí hoặc nghĩ cách trình bày bộ chữ số bí ẩn sao cho hấp dẫn. Khơi dậy óc sáng tạo và khả năng thể hiện cá nhân trong sản phẩm STEAM. Kỹ năng sử dụng công cụ và thao tác kỹ thuật Tùy vào hình thức tổ chức (dùng giấy, bìa màu, que tính, hay phần mềm thiết kế số), các em được rèn luyện kỹ năng cắt, dán, lắp ghép, sắp xếp hoặc thao tác trên phần mềm đơn giản. Kỹ năng tự đánh giá và điều chỉnh Các em tự kiểm tra sản phẩm, đối chiếu với yêu cầu đề bài, phát hiện lỗi sai và điều chỉnh để hoàn thiện sản phẩm tốt hơn. Tạo thói quen tự học, tự chịu trách nhiệm với kết quả của bản thân."
S001,Q3,0.35,構造化は序論・本論・結論が明確に区分されている点でAI的に見えるが、AI模範解答との類似度が0.00であり、内容は他の学生と共有される一般的な授業計画の枠組みに留まっている。定型表現やポジティブバイアスはほとんど見られず、文体は語彙と文長で均一化されているわけではない。具体例は「Chiếc dù kỳ diệu」など一般的な実験アイデアで、他の回答と大きく重複していない。従って、テンプレート的なAI回答と判定するにはやや高めだが、完全にAI作成と断定するには十分な証拠がないため、0.35程度の低いスコアを付与した。,"Kế hoạch dạy học: ""Chiếc dù kỳ diệu"" 1. Mục tiêu bài học: Học sinh hiểu được nguyên lý giảm va chạm, bảo vệ vật thể. Rèn kỹ năng tư duy logic, giải quyết vấn đề. Rèn kỹ năng làm việc nhóm, thử nghiệm và cải tiến sản phẩm. Phát triển kỹ năng thuyết trình, diễn giải ý tưởng. 2. Các hoạt động chính 2.1. Khởi động Giáo viên đặt vấn đề bằng một số câu hỏi gợi mở: Nếu thả một viên phấn từ tầng 2 xuống sân, điều gì sẽ xảy ra? Làm thế nào để viên phấn không bị vỡ? Học sinh suy nghĩ, đưa ra các dự đoán và chia sẻ ý tưởng. 2.2. Thực hành Học sinh sử dụng các công cụ đơn giản, hãy tạo ra thiết bị giúp viên phấn không bị vỡ khi thả từ độ cao 3m.” Giáo viên tổ chức cho học sinh thảo luận nhóm lên ý tưởng, vẽ phác thảo thiết bị. * Gợi ý một số câu hỏi mà giáo viên có thể sử dụng giúp học sinh tìm ý tưởng làm sản phẩm. + Nếu thả rơi phiên phấn từ độ cao 3m mà không có gì bảo vệ, chuyện gì sẽ xảy ra? Tại sao? + Theo em, điều gì khiến viên phấn bị vỡ khi rơi xuống đất? + Làm sao để giảm lực tác động lên viên phấn? + Làm cách nào để giảm tốc độ rơi của viên phấn? Các nhóm thống nhất ý tưởng, hoàn thiện bản vẽ phát thảo. Lựa chọn vật liệu, dụng cụ và tiến hành chế tạo sản phẩm “Chiếc dù kỳ diệu”. Đại diện các nhóm giới thiệu sản phẩm đã chế tạo. Các nhóm thử nghiệm lần 1. Thả thử từ độ cao 3m (có thể thả từ cầu thang hoặc ghế cao). Ghi nhận kết quả: Viên phấn còn nguyên/ vỡ nhẹ/ vỡ nát. Trong quá trình các nhóm chế tạo và thử nghiệm, giáo viên có thể đặt một số câu hỏi gợi mở: + Dù của nhóm em đang mở ra tốt chưa? Có chỗ nào bị gấp hoặc co lại không? + Khi thả xuống, viên phấn rơi nhanh hay chậm? Tại sao? + Dù có giữ được phương thẳng đứng hay bị nghiêng? Điều này ảnh hưởng gì đến viên phấn? + Nếu dù của nhóm bị rơi nhanh, nhóm sẽ điều chỉnh gì? + Sợi dây nối dù và viên phấn dài ngắn thế nào thì hợp lý? + Viên phấn có bị va đập vào đất mạnh không? Tại sao? Câu hỏi sau thí nghiệm (phân tích &amp; cải tiến) + Dù nilon của nhóm em hoạt động hiệu quả chưa? Vì sao? + Viên phấn có bị vỡ hay sứt mẻ không? Nguyên nhân do đâu? + Phần nào của thiết bị hoạt động tốt nhất? Phần nào cần cải tiến? + Nếu được làm lại, nhóm em sẽ thay đổi điều gì? (kích thước dù, số dây, hình dáng dù, ...) + Ngoài dù, còn cách nào khác để bảo vệ viên phấn khi rơi không? + Bài học nhóm em rút ra từ thí nghiệm này là gì? Kết luận: “Qua hoạt động hôm nay, các em không chỉ tìm cách bảo vệ một viên phấn, mà còn học được cách tư duy thiết kế, xử lý vấn đề thực tế và sáng tạo ra giải pháp từ những vật liệu đơn giản nhất. Đó chính là kỹ năng mà bất kỳ người kỹ sư, nhà phát minh hay người giải quyết vấn đề nào cũng cần có.”"
S001,Q4,0.15,回答は自然な授業指導の語り口で、構造が整ってはいるものの、AIがよく用いる高度にテンプレート化されたフレーズや過度に均一な文体は見られません。AI similarity score が 0.00 であること、語彙や文の長さが一定ではなく、具体例も独自の創造的提案が散りばめられている点から、生成AIによるテンプレート的回答の可能性は低いと判断します。,"Trong giáo dục STEAM thường liên quan đến việc tạo ra các sản phẩm có yếu tố nghệ thuật, điều quan trọng không phải là làm đẹp, giống nhau hay đúng theo một mẫu quy định, mà là mỗi bạn có thể thể hiện ý tưởng của mình theo cách riêng. Mỗi sản phẩm đều mang một dấu ấn đặc biệt của người làm ra nó. Nếu các em cảm thấy băn khoăn chưa biết làm thế nào hoặc muốn xem ví dụ, điều đó rất bình thường. Khi chúng ta sáng tạo, ai cũng có lúc chưa biết bắt đầu từ đâu. Nhưng hãy nhớ: mẫu thầy cho các em xem chỉ là gợi ý thôi. Các em có thể từ đó nghĩ thêm và làm khác đi, chọn màu sắc khác, hoặc tạo ra một cách trang trí độc đáo, sáng tạo hơn. Đó chính là tinh thần của STEAM - không sợ sai, không sợ khác biệt, mà chỉ cần dám nghĩ, dám thử và dám sáng tạo.” Những cách hỗ trợ cụ thể để giải tỏa lo lắng đồng thời khuyến khích sự sáng tạo của em học sinh: Chuẩn bị nhiều ví dụ đa dạng. Không chỉ một mẫu duy nhất mà là nhiều mẫu khác nhau về hình dạng, màu sắc, vật liệu để học sinh hiểu rằng: một ý tưởng có thể có rất nhiều cách thể hiện. Ví dụ: Với đề tài “làm con cá bằng thùng carton”, có thể có con cá tròn, con cá dài, cá màu đỏ, cá đính vảy từ giấy màu, cá từ nắp chai... Giải thích rõ mục đích của việc xem ví dụ. Nhấn mạnh rằng: “Mình xem mẫu để hiểu cách bắt đầu, nhưng sản phẩm của em sẽ mang dấu ấn riêng mà không ai giống được.” Cách này giúp học sinh bớt lo lắng về việc phải làm giống hệt. Gợi ý bằng câu hỏi mở. Thay vì đưa sẵn đáp án, hãy dẫn dắt bằng các câu hỏi để kích thích ý tưởng: + “Nếu là em, em thích làm con cá màu gì?” + “Em muốn trang trí thêm gì cho con vật/phương tiện của mình để nó khác biệt?” + “Em nghĩ vật liệu nào có thể làm thành cái đuôi đẹp hơn không?” Cho học sinh thử nghiệm và sửa chữa. Khuyến khích học sinh thử làm một chi tiết nhỏ trước (ví dụ: vẽ mắt con vật, cắt thử một bánh xe...) để giảm bớt áp lực “làm cả mô hình ngay một lúc”. Động viên: “Nếu chưa ưng ý mình có thể làm lại mà — quan trọng là mình đang thử nghiệm.” 5. Luôn khen ngợi nỗ lực và ý tưởng của học sinh. Dù sản phẩm còn vụng về, giáo viên vẫn nên khen ý tưởng của các em. Chẳng hạn: “Thầy thích cách em làm bánh xe tròn bằng nắp chai đấy – rất lạ và độc đáo.” Điều này giúp học sinh thấy giá trị từ việc sáng tạo, chứ không phải chỉ từ việc làm đúng , làm đẹp."
S001,Q5,0.32,"The answer exhibits a highly organized structure with clear sections (Mục tiêu, Nội dung, Các hoạt động chính) and systematic numbering (3.1, 3.2, 3.3, 3.4), which is characteristic of template-driven content. The language is formal and uses standard pedagogical expressions such as ""Khởi động"", ""Khám phá"", ""Luyện tập"", ""Vận dụng"" that are frequently employed in AI‑generated educational templates. However, the text is written in Vietnamese and contains specific details (e.g., list of transport modes, animal examples, classroom activities) that reduce the likelihood of a direct AI copy, as reflected by the ai_similarity_score of 0.00. The moderate peer_similarity_score (0.34) indicates some overlap with other student responses, suggesting common instructional patterns rather than a purely AI‑generated template. Overall, while the structural and stylistic cues point toward a template‑like origin, the absence of AI‑specific phrasing and the presence of localized content lower the overall AI likeness score to about 0.32.","Hoạt động: ""Sáng tạo các mô hình phương tiện giao thông &amp; con vật từ lịch để bàn, bìa tạp chí hoặc thùng carton đã qua sử dụng."" 1. Mục tiêu: Nâng cao kỹ năng tư duy thiết kế (Design Thinking). Rèn luyện kỹ năng cắt, dán, lắp ghép mô hình. Hiểu biết cơ bản về phương tiện giao thông và các loài động vật. Tái chế, bảo vệ môi trường và ứng dụng vật liệu tái sử dụng vào sáng tạo. 2. Nội dung - Học sinh sẽ sử dụng giấy bìa cứng, bìa tạp chí, lịch để bàn đã qua sử dụng, thùng giấy carton cũ kết hợp với các vật liệu tái chế khác để thiết kế và lắp ghép mô hình: + Các loại phương tiện giao thông: xe buýt, xe máy, máy bay, thuyền, ô tô... + Các con vật quen thuộc: chó, mèo, cá, voi, chim, rùa, ... 3. Các hoạt động chính 3.1. Khởi động Tạo hứng thú, kết nối bài học với thực tế. Cách thực hiện: Giáo viên cho học sinh xem tranh ảnh/video ngắn về các loại phương tiện giao thông và các con vật quen thuộc. Đặt câu hỏi gợi mở: + Em đã biết được những phương tiện giao thông nào? + Con vật nào em yêu thích nhất? Vì sao? Học sinh chia sẻ ý kiến, tạo không khí vui vẻ, hứng thú. 3.2. Khám phá Học sinh tự tìm hiểu, nhận diện và hình thành ý tưởng sáng tạo. Cách thực hiện: - Giáo viên hướng dẫn học sinh quan sát tranh mẫu các phương tiện, con vật và giới thiệu vật liệu tái chế có thể sử dụng (thùng carton, chai nhựa, ống hút...) - Học sinh: + Chọn đối tượng muốn làm (1 phương tiện hoặc 1 con vật). + Chia nhóm, phân công nhiệm vụ cho các thành viên trong nhóm. + Vẽ phác thảo ý tưởng ra giấy. + Liệt kê các nguyên liệu cần thiết để làm mô hình. 3.3. Luyện tập – Thực hành Học sinh vận dụng kiến thức, kỹ năng để chế tạo sản phẩm. Cách thực hiện: Học sinh thực hành: + Cắt, dán, ghép các vật liệu đã chuẩn bị để tạo thành mô hình. + Trang trí, tô màu cho mô hình thêm sinh động. Giáo viên quan sát, hỗ trợ kỹ thuật cắt dán an toàn, góp ý về ý tưởng và kết cấu mô hình. 3.4. Vận dụng – Mở rộng Học sinh vận dụng sản phẩm vào hoạt động thực tế và phát triển năng lực thuyết trình, hợp tác. Cách thực hiện: Học sinh trưng bày sản phẩm. Đại diện từng nhóm/cá nhân giới thiệu về sản phẩm: + Tên mô hình. + Vật liệu sử dụng. + Cách làm và điều thú vị của sản phẩm. Giáo viên và học sinh nhận xét, tuyên dương sản phẩm sáng tạo, độc đáo. Một số sản phẩm mẫu giáo viên đã thực hiện










Hình ảnh mô hình xe đạp Hình ảnh mô hình thuyền buồm










Hình ảnh mô hình các con vật sống dưới nước Hình ảnh mô hình con chó"
S002,Q1,0.15,"AI similarity score is 0.00, indicating no direct overlap with a known AI-generated model answer. The paragraph has a modest, natural flow rather than an overly rigid introduction–body–conclusion structure, and the wording lacks the typical generic AI phrasing or positive bias. Vocabulary and sentence length vary somewhat, reflecting a human writer's style. The concrete example of planting beans is common but not so generic that it signals a template; it is specific to the respondent's own experience. The peer similarity score of 0.40 shows some commonality with other students but is far from the high overlap seen in AI-generated responses. Overall, these factors point to a low probability that the answer is a template from a generation model.}","Theo tôi hiểu “học tập qua trải nghiệm” trong giáo dục STEAM là phương pháp học tập mà học sinh được trực tiếp tham gia vào các hoạt động thực tế, khám phá kiến thức thông qua quan sát, thử nghiệm và giải quyết vấn đề bằng chính đôi tay và tư duy của mình. Đây là cách học giúp các em vừa hứng thú, vừa ghi nhớ kiến thức một cách tự nhiên và lâu dài mà còn tăng tính sáng tạo và chủ động học tập của các em. Một ví dụ cụ thể tôi từng áp dụng trong giờ học Tự nhiên và xã hội là: Học sinh trồng cây từ hạt đậu. Các em được tự tay gieo hạt, tưới nước mỗi ngày, quan sát quá trình hạt nảy mầm, phát triển thành cây non. Từ đó, các em hiểu được chu trình sinh trưởng của thực vật một cách sinh động hơn rất nhiều so với việc chỉ xem hình trong sách. Sau khi được thực hiện hoạt động này, các em chủ động quan sát hơn, ghi nhận kết quả tốt hơn và vô cùng thích thú. Không chỉ vậy, các em còn hỗ trợ nhau thực hiện và trang trí sản phẩm của mình rất đẹp. Mỗi lần nhắc lại kiến thức này, các em đều có thể nhớ lại được hoạt động và trả lời chính xác nội dung bài học."
